isbn,summary,rating
0684854554,a successful marathon runner overweight couch potato shares philosophy incorporating diet exercise everyday life making personal fitness long-term project original 60000 printing tour,9
0785279296,an exciting evangelism tool empowers communicate gospel easily naturally joyfully this breakthrough system enable meet share good news simply effectively,5
0316610690,craig childs spent years deserts american west treks arid lands search water reveal natural world extreme,8
1853716847,jane o39sullivan dreams white sands blue skies love turn dreams reality,10
0684801086,details pioneering research uncovered fact elephants communicate pitch lower humans detect woman lived celebrates time africa infinite connections,7
0231101570,the left39s leading critic takes post-cold war world including gulf war clinton administration israeli- palestinian question critique western government focuses powerless power-hungry power,7
0972289305,julia fleischer signed major record label studio ready capture voice millions hear,7
0140185445,39narayan39s fictions shown india world writing has39 enchanting collection india39s foremost storyteller rich wry warmly observed characters walk indian life- merchants beggars,8
0618118780,presents anthology travel writing published previous year selected magazines newspapers web sites,8
1899171290,this book written specifically women women39s role cultural shift crucial,10
0373262949,down for the count maxine o39callaghan released oct 23 1998 available purchase,1
0971865906,offers indictment contemporary literary writing providing assessments writers don delillo cormac mccarthy annie proulx,7
0759689733,isaac mccoy 1784-1846 lived book missionary american indians three-decade struggle countless obstacles indians alive left time teaching religion,10
0563405856,rescued out-of-control spaceship finds tiny moon source dreamstone mysterious crystalline substance preserve dreams -- give nightmares,8
0563555734,featuring 6th doctor,6
0205146155,companion vol foundations american education readings,9
032104956X,readings drawn variety sources including newspapers journal articles web pages visual aids diagrams tables charts found book visual learners process important information,10
0679866949,junie spunky exasperating kindergartener forward winning lots prizes school carnival fruit cake mind,8
0152167889,in 1878 mother39s death west thirteen-year- lizzy enders left father convent school sante fe deal non-catholic student plays part,7
0380012073,this full-cast audio dramatization gaudy night specially recorded bbc radio,8
0394562666,contains twenty fabulous one-of-a-kind knitting designs based greatest masterpieces history art full-color illustrations,6
0060172142,filling remarkable gap alan schom acclaimed historian scholar author offers complete picture napoleon bonaparte quotthe scourge europequot france39s greatest hero,9
0684837641,the executive director log cabin republicans chronicles career conservative gay activist discussing search political stance embraced self-reliance difficult encounters radical left,5
0373291906,sara and the rogue deloras scott released nov 23 2001 available purchase,10
0425149803,four romance stories surround making beautiful handmade quilts include quotpieces dreamsquot jennifer blake quotforever anniequot jo anne cassity quothand-me-down heartsquot linda shertzer quota ring remembrancequot christina,10
0821746871,fleeing unwanted marriage nama lovely anasazi finds refuge arms garrick nordstrom thirteenth-century norse warrior original,6
0553568655,eight years identity erased amelia rawlins39s memories returns new mexico ranch childhood horrors past threaten catch original,8
0679722041,rushdie39s acclaimed reissued coincide release major the satanic verses,5
0425166295,answers question quotwho iquot teachings torah offers ways enriched spiritually live satisfying lives,8
0679417680,the author describes eighty-two day voyage columbia river source chronicling adventures local wildlife encounters on morning june 18 1990 high,7
0525451331,emphasizes different languages spoken different parts world giving examples french german arabic spanish,3
1411600770,quotthe healing consciousquot stirring collection poems depicting words dying commencing imminent death spiritual rebirth america transgressing birth conception ethiopia,9
0194312828,a practical dictionary carry,6
0934678898,satirically explores barbie dolls different guises professions including grunge barbie pms barbie virginia slims barbie barbie antoinette anita hill barbie,10
0967059844,the book outlines start commercial freelance business home,6
0312865783,like title black wine rare darkly glowing iridescence a taut spare wonderful creation the edmonton journal,5
0452260965,completely revised updated information digital age remains definitive guide world photography 300 illustrations,10
0764547186,this book bring programmers non-technical professionals including casual programmers scripters painlessly speed aspects mastering javascript,8
0140244328,tells inside story group quotcrypto rebelsquot teamed corporate interests beat big brother ensure consumers39 privacy internet reprint,6
0836228111,a child psychologist emphasizes importance understanding -- understanding parent39s task child39s breakthrough -- difficult time childhood development by author parent power original,10
0800753305,argues communication number marital problem tells improve one39s communication skills describes ways draw untalkative spouse,3
1559704756,a rich evocation 1588 england adventures arthur dudley illegitimate child elizabeth i presumed dead real parents learns identity adoptive father39s death,8
0812968220,the discovery grave unknown union officer antietam battlefield leads parks department archaeologist dan spaniel baffling historical mystery finding murdered identity,5
0140034994,this complex self-discovery -- considered author work -- traces path aging idealist lambert strether,7
0849913330,charles swindoll outlines decisions accompanied disciplines lead deeper intimate relationship almighty contribute peace middle quottryanny urgent,9
0140166033,quotthe gates ivory vibrant mesmerizing juxtaposes cynical sophisticated realm london dreaded world khmer rouge pol pot39s cambodia,7
0812500407,regent prince julian murdered king jehan prove throne locating mastering jewels power lost bloody father39s life,7
1589392647,newlyweds mr mrs fitzwilliam darcy begin married life pemberley blissfully long tranquillity relish cut short series traumas,9
1895636221,samuel l jackson phantom lord amp metallica a kid who39s hots mom39hunh39 that39s it39s collection immediate lean visceral short fiction clint burnham,5
0806928638,the complete current ratings beer style stouts ales porters lagers wheat beers fruit beers,7
0971304521,fallen movie idol matt logan writes journal secret letters michaella child lost,9
0375502505,stories explore theme opposites -- alienation passion life art -- tales woman feels flee witnessing husband39s death princess cold climate marries prince,5
0590471406,a collection mini-biographies achievements us navy admiral david farragut baseball player roberto clemente singer gloria estefan schoolteacher jaime escalente notable hispanic americans original,8
0786815728,when friend tom accused murder teenage sleuth pc hawke partner mackenzie attempt clear friend39s unraveling circumstances surrounding death museum39s chief biologist,1
0440407923,with be kind animals week coming molly advertises homeless animal love cuddle act furry critters bargained original,8
0679891412,a series middle-grade fans black stallion series creator equestrian adventures thirteen-year-old danielle connors battles famous young jockey alec ramsay retain beloved horse redman,10
0446675342,pril henderson stunned ruth campbell friend next-door neighbor decade unexpectedly abandons family pril confronts devastating choice destroy relationship,9
0786812923,pamela birthday glamorous aunt louise takes broadway musical,10
067942069X,francis house catch murderer feline friends meets bizarre cult kitty computer whiz perceptive persian,9
0451204727,on brink 1944 allied invasion europe winston churchill learns nazi development horrifying weapon pacifist american doctor fanatical jewish assassin undertake deadly mission reprint,9
0373872224,toward home carolyne aarsen released jun 24 2003 available purchase,8
0553262165,a japanese-american woman back life internment camp world war ii tells fear confusion ultimate dignity shaped life copyright libri gmbh all rights reserved,8
0002256967,eleventh commandment jeffrey archer connor fitzgerald impressive resume,8
0671683292,this collection stories puzzles diverse matters american domestic life depicting energetic trials romance responsibility unpredictability relationships,4
0679742018,looks freedom russia berlin nicaragua gulf war africa pokes fun lee iacocca dr ruth,8
014130880X,when intrepid hero limpy he39d turned games upside found peace human position cane toads,8
0843946024,top-ranking government officials plotting restore fallen empire soviet union make plans unleash nuclear holocaust destroy world order,6
0345421868,the gulf stream heats reporter peter dees castro sinks physical decline cuba thrown turmoil -- great story denouement nuclear blast ninety miles american shores original,5
0441777767,against bloody backdrop spanish civil war robert florry beautiful lover sylvia capture bring justice former friend julian raines russian spy,5
0786916591,the epic story begun quotthe scorpionquot based trading card game continues the crane clan champion young samurai -- power riches glory honor -- seeks audience scorpion empress,9
0786917989,in based legend five rings trading card game members phoenix clan seek knowledge forms preparation ultimate confrontation power dreaded black scrolls original,7
0786918799,in seven-book series crab clan protected empire centuries demon armies shadowlands,8
0786919043,in epic conclusion clan war series demon god fu leng seizes emerald throne rokugan clans put ancient animosities join forces destroy monster original,8
0439154111,the classic bizarre carpathian count drank human blood stay alive englishman knew secret,10
0821768344,posing wife mysterious devilishly handsome save danger formidable lady finds caught world adventure intrigue love,6
0345391233,stating human beings power call angels important tasks examination hierarchy explains responsibilities nine choirs describing author39s personal experiences original tour,9
1899866264,already succesful cult magazine 39cheap date39 - book - imaginative second-hand clothes buyer eccentric 39alternative consumer39,6
1888145005,a simple small token compassion group lost hungry kittens brings warmth home,8
0816319642,if felt heartache rejection things different perspective wound zeal uphold truth value policy politics book,10
014131334X,this story paul italian grandfather nonno special bond share,8
0091800579,a young woman travels occupied france 1942 carry mission british intelligence search lover english airman missing action,7
188184708X,in 1985 correctional officer sergeant burchfield murdered san quentin masters convicted sentenced death sharpening blade killed masters suffered extremely violent past,9
0684832798,while visiting senegal sarah stewart married rising career track falls love literary mentor ibrahim mangane emergence american civil rights movement afrocentrism sarah finds,5
0312179146,it39s sort deceit hold family tear asunder separate children or the good children masterpiece lies love insanity possibly murder,7
078686172X,the author best-selling critically lauded no witnesses delivers powerhouse thriller featuring sergeant joe quotdartquot dartelli forensic doctor confronts string deaths caused rare chemical,9
0060937726,scholar american culture m h dunlop penetrates psyche new york city pivotal years made famous edith wharton vanderbilts rockefellers unveiling age genteel proper dangerous,7
0811802426,humorous facts fallacies associated folk wisdom myths lore associated pregnancy babies,5
0395827590,celebrates life work powerful newspaper publisher includes information relations hitler mussolini churchill roosevelt turbulent private life,6
0914294547,contains piece major fiction mark twain created totally unabridged state,8
038549677X,carmen santos flamenco dancer affair married director begun sour begins grandson furious love triangle takes shape reprint 40000 printing,7
0380790882,a police lieutenant elite quotred dogsquot retired twenty-nine aud torvigen rangy six-footer eyes color cement tendency hurt,7
0802485804,he helps readers learn accept identities children god live in free last readers encouraged defined controlled actions they39ve bought price,6
1551665034,the hourglass elizabeth gage released jan 25 1999 available purchase,7
0395253799,in episodes hippopotamuses reinforce friendship,7
1562921029,this book give ponder important relationship -- matter you39ve married day 50 yearsthis delightful book basic practical filled timeless wisdom bible covering,8
0451147723,after twelve years slave movie studio despotic husband sex-symbol image madeline beautiful american actress moves italy fresh start life,1
0821724029,martinique aristocrat christopher phillips mistakes young housekeeper dionne martin woman father chosen christopher39s wife univited advances stunning servant inflame desire,1
0671731408,an ex-confidence master impostor recounts crimes capture imprisonment current career highly paid crime consultant,7
0060190094,an account family39s experiences postwar america chronicles cultural transformation flight suburbia materialism sixties counterculture describing today 50000 printing 75000,5
1561707295,louise compiled gems truth awaken tap inner wisdom changing beliefs change world,10
0312267657,in days freud39s theories changed psychology scientific hypnotist dr perlman save hysterical teenage girl grasping clutches charming dangerous imposter professions spirituality,8
0060253649,your future glimpsed crystal ballhurry thursday arrived streets tiny irish village chock-full fun what buy market day penny today,8
0865473897,now available paperback long-awaited collection short stories author a sport pastime,8
0385314035,the american woman reach summit everest describes training constant danger pressing threat death,7
3548602967,a wanders streets oslo killing path but killer lives life apparently wife ingeborg job data processor -- eventually police,7
0785275207,it39s time gentle eating eight-week program designed increase self-esteem self-awareness gradual steps - spiritual thinking emotional physical changes result growth outer,8
0375400249,offers portrait contemporary american west examing dichotomy myth reality old west present day discussing history future region,10
0385301421,kathy baker young probation officer finds caught middle palm beach county florida threatens life bigoted redneck judge quotmaximum bobquot briggs somehow kathy baker nifty young probation officer,8
1556111479,chronicles life film39s quotcelebrityquot recounting pickford39s rise stardom tremendous power influence film industry rumors bout alcoholism marriages douglas fairbanks buddy rogers,7
044922452X,a royal navy midshipman alan lewrie age high caribbean florida ship39s officer falls love adventure set late eighteenth century,7
0002214067,beginning 1850s shows effect american civil war england particularly lancashire,10
0689817002,in future population police enforce law limiting family children luke lived twelve years isolation fear quotthirdquot convinces government wrong,7
0762102624,our understanding mind effects energy slowly developnig this book explores body creates energy feeling tired tips maintain health,4
1573922684,written defender reason personal liberty book reviews historical roots nonbelief defends reason reliable method humans establishing truth conducting one39s life,9
0590334174,examines qualities cheerleader describes duties equipment basic skills cheerleading,2
0325005141,collects poems letters artwork children new york city schools united states captures response september 11th terrorist attacks,10
0747255342,moderne brevroman udveksling e-mail breve,5
0345336674,presents fresh view american revolution chronicling key events 1776 1781 assessing repercussions america england france nations,7
0310232481,welcome wonderful world lily robbins in fun story series sold million copies you39ll meet awkward sixth-grader named lily,5
031023249X,adventures 6th grader lily christian values 9 yrs,6
0380729881,returning home 1678 catherwood lyle one-year-old daughter lose dense woodlands albany new york spend summer traveling treacherous landscape reprint,8
0451522257,lewis39s pulitzer prize-winning recounts story doctor isolated seeker scientific truth forced give trade reasons ranging public ignorance publicity-mindedness great,7
0679722548,set hollywood ultimate hollywood takes readers eerie emptiness tinseltown defines machinery moviedom reissue movie tie-in,8
0312982496,offers fascinating profile galen charles kittleson legendary military exploits including role elite alamo scouts 1945 ventured deep enemy lines rescue hundred prisoners,8
0892747382,you free effects rejection no totally escapes rejection but damaged our father provided means his children delivered painful consequences rejection,10
1403325200,a story passion innocence deep longing love -- -- this woman39s history miracle miracle -- -- i dare stop reading intriguing mesmerizing,10
074321627X,in missouri town boone39s lick colorful cast characters stands edge western frontier ready push west fort phil kearny wyoming,6
155050164X,thirteen-year-old amanda winds mysterious dangerous tunnels past moose jaw attend cousin39s wedding,10
1550501933,andrea back moose jaw back tunnels past time break theft ring made surprising criminals,9
0375409297,examines technology significant figures cartography including accuracy ancient chinese maps contributions navigators ferdinand magellan james cook development current global positioning,8
0812918169,a noted expert field economics analyzes japan39s rise economic power perceived threat american interests arguing japan39s current economic status continue twenty-first century,10
0670830496,offers unique four-stage program recovery traumatic events life advising turn traumas positive forces personal growth,7
1886652074,margaret ralston kennedy travels thirteen children kansas territory struggles defend homestead savage years quotbleeding kansasquot,7
1579546390,a guide women protect oneself violence offers information keeping safe wide variety situations includes advice self-defense products internet safety workplace violence,9
1570717737,in weeks beauty expert diane irons bring fit fabulous,7
0520037626,this comprehensive book aid gardener making start native plants,9
0064472256,on sixteenth birthday cope unexpected death father david schumacher decides -- -- change blue avenger hoping find make difference oakland neighborhood,8
0156007371,an examination rock-and-roll legend39s taoist nature traces search purpose meaning volume presents forty- taoist concepts year elvis39s life reveal tao operated,8
0664256937,in book adams demonstrates readers discover often- neglected humor bible biblical stories rough edges -- unethical ambiguous characters unsolved problems,6
1865081825,ten fantasy stories tease intrigue astonishing margo lanagan,7
0385188838,three elderly women -- actress brothel madam woman named alice -- dine savoy discuss alice wonderland fictional exploration lives lewis carroll39s favorite photographic models,8
0310536510,a one-year devotional guiding readers entire bible,7
0679457739,examines failure institution marriage america discusses marriage disappointment women explains institution revitalized provide environment women children,2
1563920301,haynes disassembles subject vehicle documents step instructions clear photos haynes repair manuals pros written do-it-yourselfer,4
0553209906,after nuclear monastic order american southwest dedicates preserving books,8
0425184714,feeling place family role world annie revels chance life father suddenly forced place aboard family oyster boat finds comfortable,6
0590452681,an introduction sun moon solar system different aspects earth,10
0595148263,sports illustrated called book quotan entertaining exhaustive account tumultuous seasonquot robert w creamer author definitive biography ruth quotmr wood lit turbulent important,10
1567510817,presents myths facts social problems confronting american adolescents offering perspective crime violence drugs pregnancy suicide,4
0735203474,unravels mysteries nonverbal male-female communication -- including gestures facial expressions eye contact proximity -- describing misunderstandings arise nonverbal communication enhance,8
1878448927,fleeing failed love affair tulsa heads montana job disc jockey brings unexpected romance,3
0425103455,gathers selections wolfe39s previous essay collections american culture vietnam war art architecture space program,8
0373709633,annalee and the lawman lyn ellis released dec 25 2000 available purchase,9
0061082694,when lady gillian ellicott ward bold scottish landowner schemed outwit win estate,5
0609807250,focusing recovering virtues bound president the church jesus christ latter-day saints shares blueprint healing nation beginning family human soul,10
0684807572,a questionnaire designed evaluate sort quotbrainstylequot person accompanied helpful advice self-knowledge enhance one39s self-esteem career love life 35000 printing tour,7
0806518154,suggests ways mentally fit mental exercises increasing focus concentration,8
0895293676,helps readers learn effective ways developing meaningful relationships intimacy ultimately love,8
0843940158,abducted handsome turk malik bey carried away exotic homeworld sultans palaces amelia ryder finds unable despise captor entreats bride original,7
0198319703,contains introduction play text play notes,9
1884956262,internationally-known speaker marriage family counselor therapist authorcoauthor 19 books including 42-million- copy best-seller born win muriel james continues offer insights warmth support it39s,8
0312283334,a stunning biography legendary french queen explores scandal intrigue regal extravagance surrounding life events leading death guillotine reprint,10
0517599414,draws interviews parents social workers provide workings us family court system,10
0517585243,advises parents newborns deal crying colic separation problems expected arise,5
0307101711,on day picnic outing jessie sick stay bed mom finds cheer,8
0595217990,one man39s journey heart soul find savior future,10
0873226917,demonstrates shooting passing dribbling rebounding offensive moves suggests multi-person drills discusses offensive defensive strategy,6
0805453520,the award-winning entertainer discusses turmoil life resulting breakup twenty-year marriage reveals strength christian faith helped put life back,5
1572306416,this book presents solid science-based information topics talking aren39t talked satisfying sex questions hormones anatomy stds body image,6
0192116819,real ladies travel-or this collection women39s travel dispels myth amusing thrilling extracts prove corners world visited lady travellers,5
0312081367,among questions included volume world peace possible why best-tasting foods worst is snowflakes alike,6
1587218224,the sketches book drawn memory authors elders the passage time repainted events places slight injury accuracy,5
0590413872,a young llama asks friends mamas llamas finds rhyme mothers types animals,6
0764225146,after older sister dana diagnosed cancer erin family deal resulting anxiety finding relationships god put test,6
0806958952,this unique book highly recommended public library collectionsquot -- library journal quotwhether you39re create keepsakes friend you39re cherish creative ideas offered evershed,8
0967673763,traces life princess sultana struggle identity male-dominated culture reveals practices arranged marriage sexual abuse saudi arabian women,5
0596005466,a complete guide sambathe fileprint server ties systems different types serving files nonmicrosoft systems microsoft39s smb protocolincludes basic configuration security logging troubleshooting,7
0316737593,what supposedly boarding school gifted teenagers training facility young spies fail memories erased,5
0786704144,a eurasian woman39s survival,6
1591840376,offering dynamic pragmatic approach business success helpful handbook introduces insights methods practices techniques tools strategies skilled business leaders variety businesses motivate,5
0763617261,in future computer implants heads control environment boy meets unusual girl trouble,10
0385492790,yet remarkable collection includes riveting scenes lives ordinarymen women accomplishments recorded history books experiences equally important african american,10
0974098604,front back cover flaps color sides,10
0812574664,a cadre ss generals seizes nazi germany hitler places himmler power immeditely concentrates forces west laying ground work vastly different battle bulge higher stakes,7
1560253002,now publishing39s successful adventure literature series returns storm first-hand accounts battling elements hurricanes blizzards tornadoes sandstorms mountains plains jungles,5
0803495269,april wilde vowed give heart away,9
006016042X,sixteen stories centering small-town existence peoples39 lives shaped love explore ways loneliness color individuals39 longings affection,8
0140386726,a collection stories featuring leprechauns ghosts time travel extraordinary creatures experiences,7
0671721054,a monolithic computer general raj whitehall reunite planet start humanity back road technological achievement armies musket- saber-wielding barbarians stand original,7
