isbn,summary,rating
0671876473,after uniting civilized areas planet bellevue general raj whitehall target paranoid overlord barholm clerett,7
0974106704,quoti recognize kirby wright citizens pacific rim,9
0393022269,tells stories chorus girl unhappy love affair prostitute woman longer love english-west indian marriage,9
0789712229,discusses windows 95 basics programs managing files working printing documents wordpad graphics multimedia programs communications,5
068802405X,dear mr henshaw i wish stop stealing stuff lunchbag,9
0966987748,a wide-eyed archeologist aldebaran lands greece study sharp-tongued professor paleography,10
0446672726,yet benna disillusioned cynical bitter with brilliant imagination wit extraordinary explores benna39s world misheard exit lines love gained lost truths told fragile desperate hope,8
1400047986,the cyclist describes adventures places ireland australia mexico south america,9
0140348875,as different girls -- lacey pinkerton raven cruz kiki de santis april lovewell -- compete title miss peggy sue paradiso high39s peach blossom festival realizes winner pay life,7
0449005739,as fiendish vampire preys terrified inhabitants victorian london famed vampire hunter dr abraham van helsing leads team determined track destroy undead killer,6
1878825046,presents ideas america39s influential intellectuals readable interview format offers chomsky39s views violence united states quotdemocracyquot means coming ecocatastrophe clinton39s,6
067942427X,while researching story detroit screenwriter jack broderick meets 1940s-child-star-turned-bag-lady blue tyler life precipitous turn fell love underworld killer jacob king 50000 printing,8
0679421572,traces evolution american antiques market focusing fortunes valued eighteenth-century pieces pass hands modern pickers dealers restorers collectors 15000 printing,10
0393314588,gathers poems walt whitman emily dickinson octavio paz joseph brodsky marianne moore adrienne rich robert frost langston hughes displayed public transportation new york city,7
0812519825,when evil professor devale witch servant zady time destroy kelvin knight hackleberry family succeed kelvin stop reprint,9
0689818726,when thirteen-year-old chrissa paternal grandmother39s farm learns absent father reasons distant relationship mother,8
0449224228,then helps create unlicensed law practice angers notorious vietnamese gang this deeply affecting story set little saigon vietnamese community los angeles optioned feature film mgm quotexuberant,6
0140123385,after leaving manhattan publishing job laurie graham occupies renovates rural new jersey home shared late husband affirming works manage,8
0553014129,essays 20th century39s greatest thinkers explore topics diverse artificial intelligence evolution science fiction philosophy reductionism consciousness presenting variety conflicting visions,9
0062500481,the wonderful story bubber lemming teaches conformity individual values,6
0439116759,gathers selections stories judy blume roald dahl beverly cleary james howe ann m martin patricia maclachlan betty horvath johanna hurwitz suzy kline susan wojciechowski dick king-smith miriam cohen,8
0897330862,johannes bunny pinneberg struggle survive harsh conditions life germany years rise hitler,5
0441010369,when twelve-year-old kate39s grandfather discovers sun39s imminent death hunt solution mysteriously luminous star trethoniel kate battle star39s commander save grandfather reprint,4
0789303566,in essential manual women 20 remarkable achievers tops fields -- health experts spiritual leaders successful businesswomen -- offer strategies maintaining sound mind fit body today39s modern,8
0440228840,seventeen-year-old jessica allodola discovers vampire world fiction real develops relationships alluring vampire named aubrey teenage witch save jessica clutches,8
0345331974,international standard book number book earlier editions,5
0688166253,the book packed illuminating anecdotes profiles fascinating -- artists urban planners zen masters -- describe found purposes,8
157324063X,daily meditations affirmations women accept learn support especially times transition crisis,10
0679751661,informative alarming aphorisitc the disappearance childhood triumph history prophecy,8
0821738070,a modern epic search truth world mad,8
0151269300,a pair mexican orphans disrupt jake hollander39s plans set shop saloonkeeper el paso,5
0595129803,on earth made small technology ancient evil hidestarship persephone faded beauty affluent past colony transport,8
0151921504,the lady american theatre prolific witty writer set discover real new york intention ruts exploring environments,8
0553103024,the author recounts year teaching alaska frontier white adults resent teaching indians relationship half-indian,6
0671028057,with week redo science project sabrina harvey valerie libby find accidentally transported back france 1783 held captive montgolfier brothers inventors hot air balloon,10
0373243871,the millionaire and the mom patricia kay released mar 23 2001 available purchase,5
1565655206,when accidentally exposed beam radiation school field trip thirteen-year-old anne invisible malevolent creature plaguing,3
0553079298,mercedes eduard dignified survivor poverty save spoiled willful california daughter kidnapper teach important lesson 50000 printing puzzle lies deception,5
0199166617,here popular owls storybooks time stage 7 aid transition complex magpie storybooks robins jackdaws branches,7
0764565168,author ann douglas stuff wise preachy friendly overbearing keep book close hand instant guidance highs lows extraordinary time,8
187923744X,proven cognitive techniques assessing improving maintaining self-steem talking back critical voice inside 288 pgs,5
0933174659,provides puzzles games illusions cover concepts mathematics,7
0738200336,in landmark book twentieth century39s greatest astronomers presents scientific evidence vast universe grain sand infinite cosmic shoreit widely accepted universe exploded,5
1893224546,a series lectures renowned physicist reviews past ideas aristotle newton einstein39s theories gravity big bang black holes explores quantum mechanics time space proposition,7
4770016883,eleven remarkable stories - including manga comic - eleven brightest daring writers japan today fresh quirky sexy bold,7
0452263174,for enjoy science fact fiction leading expert quantum theory imaginatively explains faster-than-light communication travel explored physicists,7
0688157491,the author describes friendship president clinton political career whitewater scandal led imprisonment,8
0253212731,the collection indispensable resource interested twentieth-century philosophy,3
0804113882,john nickel african american blues musician managing memphis bar hires white brother sister trouble pines reunited ampquo,6
0374521344,then barthes contemplates photograph mother child book exposition mindquot -- alibris,10
0752825410,however killings difference place thirty years stuart born,7
0001850121,they nearing long journey,8
0590937065,tells story miriam young girl raised widowed father ancient israel grows mary magdalene,7
0897500318,this reprint 1899 original complete study samurai life exhaustively researched original documents,2
0762401788,includes short stories poems works great american writers,10
0786705965,in ingenious tales likes falstaff hamlet bard set hot pursuit fresh clues solutions bloodiest plots nastiest deeds hidden shakepeare39s plays,3
1561010812,micks takes readers nicene creed step step questions acquaint fourth-century background discover creed39s theological corporate personal relevance today,10
0385504217,as langdon gifted french cryptologist sophie neveu sort bizarre riddles stunned discover trail clues hidden works leonardo vinciclues visible ingeniously disguised,10
0061012548,a story burning ambitions vicious power plays sensual double-dealings entertainment world characters unbridled sex takes farther amount talent drive,10
0471183679,solidly researched finely written tragic seldom-told story illuminates ruined landquot alan t nolan author the iron brigade lee considered general robert e lee civil war history quota richly,6
0060090324,in reassuring book leslie fram combines fundamental wisdom guerrilla tactics humor inform empower millions women dating divorcs -- someday,10
0440219736,set final days civil war widowed slave girl begins long daring search find children away sold slavery reprint ab k slj pw,7
0517884976,in collection interviews fifteen african-american girls ages eleven eighteen share thoughts lives self-esteem personal identity values race dreams future,8
0060162619,america39s king entrepreneurs put entertaining book advice anecdote individuals running business maintaining harmonious successful family life,5
0773761403,after parents39 death fourteen-year-old maggie theodora separated aunt unable twins sends maggie barnardo home canada determined reunited sister,10
0399232079,thirteen-year-old frannie learns hard lessons prejudice segregation friends young black girl moves small oklahoma town 1961,10
0385496842,chronicles disastrous hartford circus fire 1944 tragedy claimed 167 lives changed history city,6
0471214205,quot -- jeremiah tower quotthis wonderful book cherish enjoy -- love gloriously meticulous writing wit joy food french southern love friends accept pleasure,9
0671007955,asked fling peggy nettleton investigate disappearance future stepdaughter model vanished posing nude photographs detective tanner remembers feelings peggy uncovering deadly secrets,7
0140289526,an named pickleherring living restorationera london claiming actor shakespeare39s troupe originally played bard39s famous female roles offers instructive salacious altogether delightful,7
0966234634,the world mood indigo stained-glass cartoon kind place piano dispenses cocktails kitchen mice dance sound sunbeams air parts jazz,6